{
  "eventClass": "S-2299",
  "tenantId": "tenant-a",
  "sourceEventId": "source-event-S-2299",
  "sourceEntityId": "source-entity-S-2299",
  "environment": "qualification",
  "employerCnpj": "12345678000199",
  "employeeId": "employee-1",
  "cpf": "12345678901",
  "registration": "MAT-1",
  "kind": "with-notice",
  "terminationDate": "2026-05-31",
  "terminationReasonCode": "02",
  "projectedNoticeEndDate": "2026-06-30",
  "ideDmDev": "RESC-1",
  "rubrics": [
    {
      "rubricCode": "RUB-RESC",
      "quantity": "1.0000",
      "amount": "2500.00"
    }
  ]
}
